<?xml version = "1.0" encoding = "UTF-8"?>
<xs:schema xmlns:xs="http://www.w3.org/2001/XMLSchema">
    <xs:element name="expresionesRegulares">
        <xs:complexType>
            <xs:sequence>
                <xs:element name="usuario" maxOccurs="unbounded">
                    <xs:complexType>
                        <xs:sequence>
                            <xs:element name="nombre" type="xs:string"/>
                            <xs:element name="apellido" type="xs:string"/>
                            
                            <xs:element name="email">
                               <xs:simpleType>
                                    <xs:restriction base="xs:string">
                                        <xs:pattern value="[a-zA-Z0-9._%+-]+@[a-zA-Z0-9.-]+\.[a-zA-Z]{2,}"/>
                                    </xs:restriction>
                                </xs:simpleType>
                            </xs:element>
                            
                            <xs:element name="telefono">
                              <xs:simpleType>
                                    <xs:restriction base="xs:string">
                                        <xs:pattern value="[6789][0-9]{8}"/>
                                    </xs:restriction>
                                </xs:simpleType>
                            </xs:element>
                            
                            <xs:element name="codigoPostal">
                              <xs:simpleType>
                                    <xs:restriction base="xs:string">
                                        <xs:pattern value="(0[1-9]|[1-4][0-9]|5[0-2])[0-9]{3}"/>
                                    </xs:restriction>
                                </xs:simpleType>
                            </xs:element>
                            
                            <xs:element name="nombreUsuario">
                               <xs:simpleType>
                                    <xs:restriction base="xs:string">
                                        <xs:pattern value="[a-z][a-z0-9_]{3,15}"/>
                                    </xs:restriction>
                                </xs:simpleType>
                            </xs:element>
                            
                            <xs:element name="contrasena">
                               <xs:simpleType>
                                    <xs:restriction base="xs:string">
                                        <xs:pattern value="(?=.*[a-z])(?=.*[A-Z])(?=.*[0-9])(?=.*[^A-Za-z0-9]).{8,}"/>
                                    </xs:restriction>
                                </xs:simpleType>
                            </xs:element>

                        </xs:sequence>
                        <xs:attribute name="id" type="xs:int" use="required"/>
                    </xs:complexType>
                </xs:element>
            </xs:sequence>
        </xs:complexType>
    </xs:element>
    
</xs:schema>